Position,Description,Url
Senior Machine Learning Engineer,"What is Pathrise?
Pathrise (YC W18) invests in undervalued university students or young professionals by coaching them to get a competitive internship or job. The program is completely free upfront. In exchange, Pathrise fellows agree to pay back a share of their first year's salary if and only if they get hired.

Pathrise is looking for early team members that will work closely with the founders on every aspect of the business. As an early team member, you will help shape the company's vision and culture from the ground up and will have the opportunity to learn about and tackle all aspects of a thriving business.

Most importantly, you will be helping students and young professionals through one of the most crucial periods of their lives, supporting them in finding their dream job.

Our Mission
We seek to uplift and provide guidance for undervalued students and young professionals in their early career. Read more about why we’re driven to do this in our manifesto.

WHAT YOU'LL DO

Advising & Mentorship: Coaching and instructing your Pathrise fellows will be a core part of your day-to-day responsibilities. We’re looking for natural teachers who care about mentorship and uplifting others.

Handling 1-on-1 and small group mentorship, technical interview prep (i.e. data structures/algorithms/web/mobile), and behavioral prep for 15-25 fellows a month.

Investing in students’ personal stories and advising them on their career trajectory

Building up and improving the curriculum and insights that we teach our fellows

Helping students optimize everything from their resume to their negotiations

Engineering, Data, & Product: We think about the career search as an optimization problem where we can improve the individual outcomes of our fellows with data-informed decisions. You’ll be involved in engineering key components to make this happen including:

Building a set of utilities to optimize all of the custom workflows we have with Pathrise fellows, and apply the data we are collecting

Ideating, scoping and prioritizing new tools using fellow data that are high value

Making key technical decisions on how to build out Pathrise features and tools

Incorporating hybrid human-machine interfaces to increase efficiency and efficacy

Shaping our engineering culture and improving how we iterate and ship code

WHO YOU ARE

All the qualities of a first employee (comfortable wearing many hats, willing to dig deep in tough times, ability to take vague requirements and optimize for impact)

A strong communicator that can explain complex concepts in a simple way

Loves mentorship and helping others succeed

Solves problems with an engineering and analytical mindset

Experience in a fast-paced work environment and works with a bias for action

Have the potential to “scale” with the company and take lead as we grow
MINIMUM QUALIFICATIONS
1+ years of experience in the technology industry or in a related field
Must be willing to work in San Francisco Bay Area
PREFERRED QUALIFICATIONS
Bachelor's degree in Computer Science or similar technical field of study or equivalent practical experience
3+ years of experience in the industry as a Machine Learning Engineer or in a related field
Experience building full-stack machine learning utilities
Experience with teaching, career advising, and mentorship in education
We do not discriminate on the basis of race, religion, sex, gender identity, sexual orientation, age, disability, national origin, veteran status or any other basis covered by law. If you need assistance or an accommodation due to a disability, please let us know.

If you are also interested in the fellowship, please apply here: https://www.pathrise.com/apply.",https://www.indeed.com/rc/clk?jk=ae20548c6763d6e4&fccid=ae6e171391e978d5&vjs=3
Machine Learning Engineer,"CircleUp harnesses the power of machine learning and predictive analytics to discover some of the fastest-growing companies in the consumer & retail sector. Our mission is to help entrepreneurs thrive by giving them the resources and capital they need. We are building a predictive data system called ""Helio"" to bring the data-driven revolution that has occurred in the public markets to the private markets, starting with consumer & retail.
We are working on challenging problems in information retrieval, entity resolution, and machine learning. We are developing an in-depth knowledge graph of all private companies by mining vast amounts of data to successfully rewrite the rules on how private companies are evaluated.
CircleUp has been named one of the Top 5 Most Disruptive Companies in Finance by CNBC, one of the 50 Best Fintech Innovators by KPMG, and one of America's Most Promising Companies by Forbes. We are backed by top-tier investors including Google Ventures, Union Square Ventures (backers of Etsy/Kickstarter), and the ex CEOs/Presidents of Goldman Sachs, Morgan Stanley, Thomson Reuters, the Stanford Endowment and Capital One.
We’re adding talented teammates to our Engineering team. You will be working closely with other engineers, data scientists, product managers, and investment professionals to build out the capabilities of Helio.
Responsibilities:
Build performant and reliable data pipelines in service of machine learning and predictive analytics.
Build our Machine Learning infrastructure, including model productization, model training, model simplification, and maintenance of existing models.
Build capabilities that increase the momentum of the Data Science team. Remove Engineering roadblocks and ensure the Data Science team has the tools needed to succeed.
Requirements:
Have a B.S., M.S. or Ph.D. in Computer Science or equivalent degree and work experience
Baseline understanding of the statistics behind Machine Learning algorithms
Excellent software engineering skills and strong fundamentals in algorithms, data structures, predictive modeling and big data concepts
Experience with our stack (Python, Pandas, Sci-kit Learn, PySpark, Airflow, AWS ecosystem) is preferred but not required
Experience with Entity Resolution or Knowledge Graph problem spaces is a huge plus",https://www.indeed.com/rc/clk?jk=2f995bb9c1a1df6b&fccid=6e9166ecf7604472&vjs=3
Data Scientist - Applied Machine Learning Engineer,"The world runs on software. Yet delivering changes to software remains massively complicated, highly manual, and risk-prone. At Harness, our mission is to simplify the entire software delivery process so that software engineering teams can move fast and ship code effortlessly without the fear of breaking things. That's why we're bringing the industry’s first Continuous Delivery-as-a-Service platform to the market.

Harness uses a unique machine learning and AI-based approach to continuously verify the performance, quality and security of highly complex software systems, and automates the entire software delivery process.

We’re backed with $20M Series-A funding from technologist and entrepreneur Jyoti Bansal, who founded AppDynamics and sold it to Cisco for $3.7 Billion, and from top-tier VC firm Menlo Ventures.

POSITION SUMMARY

This is an amazing opportunity to be an early engineer in a high-growth, high-potential startup.

Your Key Responsibilities will be:
Breaking down business problems into statistical and machine learning problem formulations for actionable insightsDevelop robust anomaly detection models based on textual, time series dataUse machine learning methods to produce insights from infrastructure and configuration dataUse feature engineering to extract the best features for a problem and apply suitable regularization techniques for robust analysisCreate new statistical models to correlate data from several different sourcesCreate quality software in Python and Java to access, process and analyze data
ABOUT YOU
BS Degree Computer Science or related field from an accredited university (MS Degree preferred)
At least 2 years of experience
Good applied statistics skills, such as distributions, statistical testing, regression, etc.
Solid understanding of data structures, algorithms, object oriented design and patterns
Excellent understanding of machine learning techniques and algorithms, such as k-means, k-NN, - Naive Bayes, SVM, Decision Forests, HMM, Neural nets, Deep learning etc.
Hands on programming experience with Java//Python
Experience building highly scalable solutions in real-time analysis for large data sets
Data-oriented personality
Effective communicator who can work with stakeholders to define requirements
WHAT YOU WILL HAVE AT HARNESS
Experience building a transformative product
End-to-end ownership of your projects
Fun work environment in the heart of San Francisco
Beer & high-end espresso in the office
Breakfast Mondays, Happy Hour Thursdays, Lunch Fridays
Competitive salary, health benefits, early stage Stock Options
A great team who will fight beside you in the trenches to accomplish your goals",https://www.indeed.com/rc/clk?jk=09e77269e281ba5e&fccid=849cecf89c5fe512&vjs=3
Machine Learning Engineer - Recommendation Services,"At Change we are a unique blend of engineers, activists, marketers, designers and scientists with a common goal: to give the voiceless a voice and a chance to be heard in today’s digital jungle; to allow everyone to connect with likeminded community and help people change the world for the better. People, the members, the activists, and our employees, are at the center of our mission and everything we do. Actually, employees at Change are a lot like the service itself: bright, brave, and innovative. Collaboration is the foundation of our workforce, and we're looking for smart individuals who are self-motivated and passionate to join us. Be a part of the team that creates a brighter future for everyone. Discover your future at Change!

Change has a great opportunity for a machine learning engineer with an academic or practical background in machine learning, ideally with experience in building recommendation systems, embeddings, knowledge extraction or deep learning who will help deliver Change to millions of people around the world. We are looking for someone who will own, lead, and execute projects. You should have outstanding programming skills with a deep understanding and proven track record of building robust, scalable machine learning systems.
As a member of our highly motivated team, you should be dedicated to excellence and have a strong sense of personal responsibility. We hold ourselves to high standards and take pride in our work. We are looking for someone who is not afraid to get their hands dirty in data and be an integral part of the machine learning team's expansion.
What you’ll do:
This is a fantastic opportunity to join the core group working on User and Communities Understanding at Change and be a part of a team that is focused on building data driven systems and machine learning solutions
Work with data scientists to use machine learning to solve a wide spectrum of problems across multiple domains, such as user understanding and matching, taste modeling through embeddings, knowledge extraction and build content / user / community recommendation systems
Contribute to ideation, prototyping, design, and production of machine learning algorithms leveraging the latest developments in machine learning, neural networks and recommendation systems
Get a rare & blue sky opportunity to design, build and scale some of these systems from scratch
Help shape the direction of machine learning and artificial intelligence at Change
Requirements:
Proficiency writing production-quality code, preferably in Scala, Java, or Python
Strong SQL experience (MySQL, Redshift/Postgres)
Experience building production systems for training and evaluation of models based on a Machine Learning lifecycle
Comfortable and experienced working with large datasets and platforms at scale
Fundamentals in algorithms, data structures, statistics & distributed systems
You are capable of quickly coding and prototyping data processing pipelines involving any combination of Python, Node, bash, and linux command-line tools
Experience with AWS or Google technologies (including Redshift, S3, EC2, Lambda) in large-scale data processing and machine learning projects
Experience working with relevant python and relevant ML libraries, such as MLlib
Familiarity with one or more Deep Learning frameworks (e.g., TensorFlow, Keras, etc.)
Excellent communication skills with the ability to distill complex issues and analysis
You enjoy creating an approach/direction from scratch and pursuing goals without directive guidance
BS degree in Computer Science or equivalent experience
Passionate about Change.org’s mission
Nice-to-haves
Familiarity with MapReduce/Spark and other relevant big data infrastructure (Hadoop)
Familiarity with DNNs for recommendation, and relevance infrastructure
Experience working with large text corpora and text processing technologiesWorkflow Automation and Kubernetes
Experience working in multiple countries, cultures, and languages
Experience with natural language processing in languages other than English (especially, but not limited to, Spanish, French, Russian, or Italian)
Can translate complex technical concepts to other staff (campaigners, etc)
Apply for this job",https://www.indeed.com/rc/clk?jk=1848b64b8db92063&fccid=3433aab0a6573d98&vjs=3
Senior Software Engineer - Machine Learning,"About Bill.com
Bill.com is the leading business payments network, with 3 million members paying and getting paid over $52 billion per year. Bill.com saves companies more than 50% of the time typically spent on financial back-office operations and helps businesses get paid 3 - 4 times faster by automating end-to-end payment processes. The company is the choice of 4 of the top 10 U.S. banks; leading accounting software providers QuickBooks Online and Xero; and over 50 percent of the top 100 U.S. accounting firms. It is the only business payments solution endorsed by the American Institute of CPAs (AICPA). The recipient of more than 70 awards, Bill.com proudly received multiple PC Magazine's Editor's Choice Awards and CEO René Lacerte was recently recognized as an E&Y Entrepreneur of the Year.

Mission:
Bill.com is looking for Python Machine Learning Engineers to join our team and solve challenging, data-driven problems. We are developing new ML models that (1) detect fraudulent transactions and bad actors and (2) extract data from unstructured documents so that customers never enter data. We are also expanding an ML-driven approach to other parts of our business.

As a Python Machine Learning Engineer, you will partner with a diverse set of teams, including engineers who build the core product experience, money movement system and risk operations. You will build and deploy machine learning models, and identify new approaches and methodologies for improving the performance of our ML applications. You will make an impact and drive the establishment of machine learning as a practice at Bill.com.
We have multiple positions available at different levels of seniority.

Responsibilities:
Build machine learning models for fraud detection and document data extraction
Drive the definition of the machine learning infrastructure and pipeline to build and scale machine learning at Bill.com (e.g feature storage, predictions and scoring)
Define metrics for feature evaluation and model performance
Explore and investigate different model types and techniques to improve machine learning performance
Participate in feature engineering and defining data requirements for different models
Leverage various AWS technologies for building and deploying models

Desired Experience and Skills:
5+ years of relevant industry experience (MS or PhD preferred but not required)
Expertise in python
Extensive knowledge of machine learning algorithms, techniques, available implementations in python (e.g NumPy, SciPy, Pandas) and frameworks (e.g tensorflow)
Strong point of view on how to build highly scalable machine learning infrastructure
Excellent engineering and problem solving skills. Able to write high performing, high quality code in python
Experience with AWS, Sagemaker preferable

Bill.com Culture:

Humble – No ego
Fun – Celebrate the moments
Authentic – We are who we are
Passionate – Love what you do
Dedicated – To each other and the customer",https://www.indeed.com/rc/clk?jk=47f8abbfe2603d8e&fccid=7d28c1874e2d22be&vjs=3
Sr. Machine Learning Engineer / Data Scientist (Risk),"About Us

Turo is a peer-to-peer car sharing marketplace where guests can book any car they want, wherever they want, from a global community of local car owners.

We are a group of creative and mission-focused data genies, environmentalists and car enthusiasts who want to put the world's 1B+ cars to better use. We do this by using data to serve our customers' delightful experiences by matching them with the right car for their next adventure while keeping our marketplace safe.

We've grown the business by over ten times in the past two years and raised over $200 million from investors like Daimler, SK Holdings, Kleiner Perkins, Google Ventures, August Capital and Shasta Ventures.

About You

You are a creative, rigorous senior machine learning engineer / data scientist who is excited to solve meaningful business problems. You are comfortable with a wide range of machine learning techniques with the ability to creatively apply them to our problems. You are proficient in translating unstructured business problems into an abstract mathematical framework and making intelligent approximations to proposal practical and scalable solutions.

You have a passion for consumer products, shipping code, and conducting data focused experiments. You enjoy developing models that will have an enormous impact on our next chapter. And you are excited to play a key role in crafting the product from inception to implementation and beyond.

Responsibilities


Work closely with product engineers, other data scientists, and product managers to develop and deploy algorithms and drive key product and modeling decisions. Work with the data science manager to ensure the models developed are production ready.
Lead the end-to-end process of conceptualizing, developing, productizing, deploying and analyzing machine learning models in the Cost of Insurance (Risk) vertical.
Present your insights and suggestions to audiences of all levels in the company.
Dedicatedly perform explorations of data and algorithms to improve our models. Research the best metrics and experiments to measure model performance.
Mentor junior team members to help them elevate to the next level.

Required Qualifications


MS in a science/engineering field with 5+ years (or PhD with 2+ years) of relevant industry experience.
Strongly self-motivated with a keen pair of eyes for details. A natural desire to learn and innovate with like-minded colleagues.
Deep understanding of mathematical methods in machine learning. Demonstrable experience applying them to real data problems such as classification, regression, recommendation system, and time series analysis.
Fluent in a production-ready programming language such as Python. Experience in deploying and scaling models into a production environment as microservices.
Fluent in data analytics tools, e.g. Jupyter notebooks, scikit-learn and PyTorch/Keras in Python (preferred), or equivalent tools in R.
Fluent in SQL or SQL-like query languages; Experience in efficiently query large datasets from data warehouses and data lakes.

Preferred Qualifications


Experience in working with risks such as insurance or actuarial science, etc. is strongly preferred.
Experience in the latest ML techniques, such as neural network.
Experience with AWS SageMaker or ETL framework such as Airflow. Experience with Spark, and/or Hive.

Benefits


Competitive salary and meaningful equity
Employer paid medical, dental, and vision insurance
Apple equipment of your choice
Four weeks paid time off, 11 paid holidays, volunteer time off, generous parental leave
Weekly catered lunch with a fully-stocked kitchen
Company-sponsored happy hours and team events
Turo owner matching and vehicle reimbursement program
Turo travel credit every month
Engineering education allowance every month

Turo is an equal opportunity employer and values diversity at our company. We don't discriminate on the basis of race, religion, color, national origin, gender, sexual orientation, age, marital status, veteran status, or disability status.",https://www.indeed.com/rc/clk?jk=c0930d01caa5d3be&fccid=c8100afc42779772&vjs=3
Senior Machine Learning Engineer,"We are looking for an experienced Software Engineer to join our team in San Mateo, CA

FuelX is the leading commerce indexing company. Our technology leverages real-time data processing and machine learning to predict online shopping behaviors and to drive conversions for the brands that use our digital advertising platform. We are growing our team, and we're looking for people to join us on our mission to index the world's commerce data.
WE HOPE YOU GET EXCITED ABOUT:
Having the opportunity to lead the data team
Owning platform automation projects with machine learning technologies from supervised learning to reinforcement learning, from linear regression to time series model
Anything you can imagine is possible to experience in a data science world here at FuelX
YOU WILL:
Design and implement machine learning and natural language processing algorithms
Build system automation
Build models for prediction projects
Quickly prototype and iterate on your data models
Build automation on model practice.
Perform fundamental and applied machine learning research in large-scale distributed analysis
Work with large data sets to predict and test statistical patterns.
YOU SHOULD HAVE:
7 years of experience with cloud machine learning APIs
7 years of experience on machine learning projects with Big Data
Experience with Java, Python, C++ and R
Experience with cloud data solution
Strong knowledge of analysis algorithms and machine learning models
Strong knowledge of statistics
Strong knowledge of anomaly detection, time series forecasting, clustering, classification, natural language processing, and customer segmentation
Fundamental understanding of Hadoop, HBase or other cluster system on Big Data solution
Fundamental understanding of user profile and behavior approaches and methodologies
Strong grasp of fundamental CS concepts such as data structures, algorithms, design patterns, coupling, cohesion, correctness, etc
Team Player mentality
EVEN BETTER IF YOU HAVE:
Experience with system automation
Experience of digital advertising",https://www.indeed.com/rc/clk?jk=fc7fe4fac36fc39d&fccid=cee5eb240fcda90f&vjs=3
