Position,Description,Url
Machine Learning Engineer,"----------------------
Role Description
----------------------

Dropbox's Machine Learning group develops high impact solutions that touch millions of people and a lot of data. From images to documents in every language, the Dropbox ML team delivers solutions using the full range of ML techniques from computer vision to supervised learning to deep learning to online learning. While some of our algorithms run on mobile devices, others require large clusters on our infrastructure.

Dropbox is looking for Machine Learning Engineers with an academic or practical background in machine learning, ideally with experience in natural language understanding, information retrieval, knowledge extraction, or deep learning.

----------------
Responsibilities
----------------


Work within the Machine Learning Team to design, code, train, test, deploy and iterate on large scale machine learning systems.
Build delightful products and experiences for millions, while working alongside an excellent, cross-functional team across Engineering, Product and Design.
Help shape the direction of machine learning and artificial intelligence at Dropbox.

------------
Requirements
------------


BS and MS in Computer Science or related field with research in machine learning
3+ years of experience building machine learning or AI systems
Strong analytical and problem-solving skills
Solid software engineering skills across multiple languages including but not limited to Python, C/C++
Experience with machine learning software packages (e.g., scikit-learn, TensorFlow, Caffe, Theano, Torch)

-----------------------

Desired Qualifications:
-----------------------


Ph.D. in Computer Science or related field with research in machine learning
Experience with one or more of the following: natural language processing, deep learning, bayesian reasoning, recommendation systems, learning for search, speech processing, learning from semistructured data, reinforcement or active learning, ML software systems, machine learning on mobile devices

------------------
Benefits and Perks
------------------


100% company paid individual medical, dental, & vision insurance coverage
401k + company match
Market competitive total compensation package
Free Dropbox space for your friends and family
Wellness Reimbursement
Generous vacation policy
10 company paid holidays
Volunteer time off
Company sponsored tech talks (technology and other relevant professional topics)

",https://www.indeed.com/rc/clk?jk=d909bf3bde9e3491&fccid=8510f9bc3a085f8e&vjs=3
Senior Machine Learning Engineer,"As a Senior Machine Learning Engineer, you’ll be a member of a team of Machine Learning Engineers working closely with data scientists. You’ll be working on the machine learning infrastructure to help data scientists develop models which will be used to improve user experience through better personalization.

You’ll build scalable machine learning platform for statistical feature mining, algorithmic feature transformations, generic predictive models, and model analysis flows for improving and continuously optimizing user engagement and revenue generation using Apache Beam, Apache Spark, Tensorflow, Scikit-Learn and Apache Airflow on large amounts of data.

We are a growing Engineering team, yet we offer a great deal of autonomy and flexibility. If you're a person who enjoys working with a lot of freedom, but knows how to take full ownership of a project and meet deadlines with quality, then this is the role for you.
Our Ideal Candidate:
5+ years of exp in Software Development.
2+ years of experience with Machine Learning.
2+ years of Big Data experience.
Experience with mathematical optimization (both derivative and derivative-free methods)
Ability to pick up new technologies quickly
Bachelor's Degree in Computer Science, Computer Engineering, Mathematics, Physics or related fields.
Experience and Exposure with the following:
Dynamic server-side OOP languages: Scala, Java, C++, Python; design patterns, algorithms, statistics, probability theory, machine learning, artificial intelligence, programming languages, networking and operating systems; web application internals and common technologies; deployment strategies

Production infrastructure: Kafka, BigQuery, Airflow, BigTable, Dataflow, DataProc, CloudML, Cloud-SQL, Akka-Http, GRPC, JavaScript frameworks
Nice to Have:
Experience with Apache Spark
Professional working knowledge of Scala
Master’s or PhD in Computer Science, Computer Engineering, Mathematics, Physics or related fields.
#LI-AG1",https://www.indeed.com/rc/clk?jk=d997c5dea5c3d8f5&fccid=18a0fc6503dc7b4e&vjs=3
Senior Research Engineer,"Los Gatos, California
Product Engineering
Are you interested in researching new machine learning algorithms to create innovative approaches to a wide range of problems, as well as building large-scale, live-traffic experiments directly impacting and growing our 135+ million members worldwide? The Algorithm Engineering team is looking for a passionate and talented Machine Learning engineer to join us and lead the way in the research and development of the next generation of algorithms used to drive and grow the Netflix experience. To learn more about our research and analytics work, you can visit our research page here.

In this position, you will conduct applied research by investigating, conceptualizing, designing, implementing, and validating new algorithms in a number of areas, such as:
Finding and growing the best possible audience for newly released movies and TV shows, and in particular our expanding slate of original content. This year, Netflix will invest $6 billion in content and will create original content with great Hollywood talents like Angelina Jolie and Martin Scorsese, and you’ll work on the algorithms that help this new content find a great audience.
Reaching out to our members about new recommendations in the most effective and impactful way, through emails and notifications. We deliver billions of messages per year, and you’ll work on the algorithms that decide what to send, when and to whom, to help our members find great content to watch.Growing our member base through programmatic advertising. Netflix spends over one billion dollars a year promoting our service and original content. You’ll work on new algorithms to maximize our growth that decide what to advertise, to whom, and for how much.

Here are some more examples of what we are working on:
The Importance of Time and Causality in RecommendationsIntroducing Vectorflow: a lightweight neural network library for sparse dataThe Netflix Recommender SystemSelecting the best artwork for videos through A/B testingRecommending for the World

To be successful in this role, you must have a strong machine learning and software engineering background, be a quick learner, and work well in small cross-functional teams. You will need to exhibit strong leadership and communication skills, an ability to set priorities, and thrive in a dynamic environment.

If you are ready to make a difference at a company that matters, and if you want to work on machine learning and data in a company that strongly believes in both, then we would love to talk to you.
Requirements:
At least five years of applied research experience with a successful track record of delivering quality results.
Strong machine learning and algorithmic background with a broad understanding of: supervised and unsupervised learning methods, bandits and reinforcement learning, deep learning.
Strong development experience (Scala, Java, Python, C++ or similar).
Great communication skills.
MS (PhD preferred) in Computer Science, Statistics, or related field.
Preferred, but not required:
Experience in recommendation systems or computational advertising.
Experience in optimization algorithms and numerical computation.
Experience with big data platforms and large distributed systems.",https://www.indeed.com/rc/clk?jk=24c50eff8ed4a572&fccid=66403b30a2c0d89c&vjs=3
Machine Learning Engineer,"Position Summary
Adobe’s mission is to change the world through digital experiences. As the global leader in digital media and marketing solutions, Adobe helps customers create, publish and monetize great content anywhere, on any platform or device. Adobe Sensei is the AI platform that allows us to supercharge our customers’ productivity. It uses artificial intelligence (AI) and machine learning to help you discover opportunities that are hidden, make tedious processes fast, and show you which data insights matter — and when they matter.
The Applied Science and Machine Learning team within Sensei is charged with building machine-learned features into a variety of Adobe Products, including Photoshop, Illustrator, Lightroom, Stock, XD, and Adobe Experience Manager (AEM). We build novel ML models in response to product requests or based on our own product ideas; transfer, evaluate and harden product solutions generated by Adobe's Research team, and help to build a library of high-quality reusable ML services.
Responsibilities
Design and implement ML features delivered either as managed services or on-device models.
Work with other engineering and research teams to deliver these features
Develop prototypes to help with future exploration
Collaborate with scientists in Adobe's pure research lab to drive cutting-edge research toward product realization.
What you need to succeed
Minimum qualifications
Recent or expected MS/PhD in Computer Science or related data-driven field.
Experience in Python/Javascript
Experience with Sklearn/Tensorflow/PyTorch
Experience with machine learning and/or deep learning methods
Additional qualifications
Experience in engineering SaaS based software development
Experience with big data processing and Hadoop.
At Adobe, you will be immersed in an exceptional work environment that is recognized throughout the world on Best Companies lists . You will also be surrounded by colleagues who are committed to helping each other grow through our unique Check-In approach where ongoing feedback flows freely.
If you’re looking to make an impact, Adobe's the place for you. Discover what our employees are saying about their career experiences on the Adobe Life blog and explore the meaningful benefits we offer.
Adobe is an equal opportunity employer. We welcome and encourage diversity in the workplace regardless of race, gender, religion, age , sexual orientation, gender identity, disability or veteran status.",https://www.indeed.com/rc/clk?jk=eab726f0e5c0adf1&fccid=f89deb5a97c7738a&vjs=3
Machine Learning Engineer - AppleCare,"Summary
Posted: Nov 27, 2018
Weekly Hours: 40
Role Number: 114392489
AppleCare Business Insight is a dynamic data science organization that provides insight to improve post sale ownership experience and to drive business impact. This role is for a full-stack data scientist within AppleCare Business Insight team to provide data driven insight to improve revenue and margin for AppleCare’s extended warranty products. You will build statistical and machine learning models to surface actionable business insights. The role engages with the business and finance teams to define problem statement, design analytical solution and operationalize the solution. The employee also works with large scale computing frameworks, data analysis systems and modeling environments (e.g., Spark, Hadoop, Cosmos, CloudML, Turi , etc).
Key Qualifications
Build data engineering assets using Teradata SQL
Develop interactive, self-service Tableau dashboards
Program in Python/R to develop predictive and forecasting models
Device advanced statistical/machine learning methods to improve critical metrics
Build production quality machine learning models
Build churn models and CLTV models
Mine huge datasets to drive actionable insights
2-3 years of experience required
Description
Excellent statistical, machine learning and analytics skills
Expert in data modeling and analysis in R/Python
Experience in data engineering using SQL, Tableau
A strong quantitative academic background
Ability to network broadly across the organization and drive collaboration
Knowledge of regression, time series analysis, clustering, decision tree techniques
Excellent oral and written communication skills
Experience in providing analytics support for subscription business is an added bonus
Education & Experience
BA/BS in a quantitative field (Statistics, Computer Science, Ops Research etc.)
Masters or PhD in Statistics is a plus.
Apple is an Equal Opportunity Employer that is committed to inclusion and diversity. We also take affirmative action to offer employment and advancement opportunities to all applicants, including minorities, women, protected veterans, and individuals with disabilities. Apple will not discriminate or retaliate against applicants who inquire about, disclose, or discuss their compensation or that of other applicants.",https://www.indeed.com/rc/clk?jk=95fc92c62ee99175&fccid=c1099851e9794854&vjs=3
Data Scientist,"Requisition Number:150574
Location:Redwood City
Date Opened:2018-06-23
Electronic Arts Inc. is a leading global interactive entertainment software company. EA delivers games, content and online services for Internet-connected consoles, personal computers, mobile phones and tablets.
Here in EA's Data Science group within Global Analytics and Insights, we're always looking for new members to help expand our horizon, to move our communal thought process. Responsible for everything from recommendations and personalization to evaluating the impact of marketing investments, our group exists to push boundaries, whether they are developing cutting edge statistical models and machine learning algorithms for marketing valuation or creating the latest and greatest recommendation systems to ensure that every player journey is truly their own.

This is a team that's as likely to collaborate with game designers and producers as they are data engineers, so versatility, persistence, entrepreneurship, and passion are keys to becoming a successful contributor. We exist in a world where tasks and measures aren't easily defined by product managers or scrums and where a project’s cadence can have defined deadlines or be as vague as knowing a game's possible launch date years in the future, so our data scientists and machine learning engineers must have strong organizational skills. The biggest and single most important aspect that we look for in aspiring colleagues is intellectual curiosity, people who love the joy of discovery, in ending the day knowing a little bit more than when they woke up.

Team-members manage projects in a collaborative, group environment, giving every person an opportunity to lead, and the projects themselves are owned from conception to design, through development and all the way into implementation. Our scope of work ranges from NLP to Recommendation Engines, Statistical Theory to AI, and the variety of responsibilities for our colleagues is equally dynamic: one colleague may bias more towards research, staying in the abstract, while another may prefer to get their hands dirty, building optimization systems directly into game-clients.

We look for PhDs (minimum masters degree) in fields such as computer science, mathematics and the hard sciences, or quantitatively based degrees in social fields, such as quant marketing, sociology, and economics. To be effective, members must have experience interacting with big data stores, wrangling complex data sets, and setting up data processing workflows. All candidates must be accomplished in a modern open source data science languages such as R or Python, while machine learning engineer oriented candidates must also have strong experience in system languages such as Java or C++. More data science-oriented candidates are expected to have good understandings of statistical theory, distributions, experimental design, multivariable calculus, linear algebra, and how computational algorithms work. Titles are dependent on the applicant; we look for team-members with all levels of experience.

Gaming is changing. Over the next few years, that change is going to accelerate and without the proper knowledge and toolsets, many developers will struggle to keep up with it. Our job on this team is to ensure that we not only keep pace but become the drivers of that evolution, to help EA lead into the future. We are excited to be a part of this and hope you will be, too.

What’s in it for you? Glad you asked!

We love to brag about our great perks like comprehensive health and benefit packages, tuition reimbursement, 401k company match and, of course, many other perks! And since we realize it takes world-class people to make world-class games, we offer competitive compensation packages and a culture that thrives off of creativity and individuality. At EA, we live the “work hard/play hard” credo every day.

More about our location: https://www.ea.com/careers/careers-overview/redwood-shores


EA is an equal opportunity employer. All employment decisions are made without regard to race, color, national origin, ancestry, sex, gender, gender identity or expression, sexual orientation, age, genetic information, religion, disability, medical condition, pregnancy, marital status, family status, veteran status, or any other characteristic protected by law. We will also consider for employment qualified applicants with criminal records in accordance with applicable law. EA also makes workplace accommodations for qualified individuals with disabilities as required by applicable law.",https://www.indeed.com/rc/clk?jk=cb3b6890e87bd5e1&fccid=617d7f961cfcf54a&vjs=3
Machine Learning/Data Science Engineer,"Change how organizations think about and make use of their data.
Gemini Data, a category defining Converged Data Analysis (CDA) company looking for seasoned Machine Learning Engineers and Senior Machine Learning Engineers to join our Marin Headquarters to be part of a highly dynamic and talented team of engineers.
At Gemini Data, we carefully mix distributed computing, graph technologies, data science, and AI to make complex IT management easy. Our approach towards solving IT management using modern tech is not about pouring old wine in a new bottle, but a practical and useful way of leveraging these advanced concepts into meaningful practice that makes complex tasks simple, provides meaningful clues to the analysts and operators, and empowers users to focus on high level tasks while enabling AI to pick the grunt work.
We’re looking for humble but ambitious, razor-sharp professionals who can grow with us and the technologies we bring to the world. We embrace those who see things differently, aren’t afraid to experiment, and who have a healthy disregard for constraints. If that’s you – apply now to join our team!
Job Duties And Responsibilities
Familiarity with machine learning frameworks (Keras, PyTorch, TensorFlow, Caffe 2) and libraries (like scikit-learn, NumPy)
Understanding of data structures, data modeling and software architecture
Deep knowledge of math, probability, statistics and algorithms
Ability to write robust code in Python, Scala/Java and R (any good combination of these)
Excellent communication skills
Ability to work on a team
Outstanding analytical and problem-solving skills
Research and implement appropriate ML algorithms and tools
Acquire real datasets & synthesize as and when needed
Select appropriate datasets and data representation methods
Perform statistical analysis and fine-tuning using test results
Familiarities with GPUs and how to use them effectively and gainfully with ML/DL
Extend existing ML libraries and frameworks
Analyzing the ML algorithms that could be used to solve a given problem and ranking them by their success probability
Exploring and visualizing data to gain an understanding of it, then identifying differences in data distribution that could affect performance when deploying the model in the real world
Verifying data quality, and/or ensuring it via data cleaning
Supervising the data acquisition process if more data is needed
Defining validation strategies
Defining the preprocessing or feature engineering to be done on a given dataset
Defining data augmentation pipelines
Training models and tuning their hyperparameters
Analyzing the errors of the model and designing strategies to overcome them
Deploying models to production
Desired Skill and Experience
4 years experience in writing software with Bachelor/Master/PhD preferably in Computer Science, Electronics or Mathematics
10 Years Software Industry experience for the candidates without at least a Bachelor degree
Proven experience as a Machine Learning Engineer or similar role",https://www.indeed.com/rc/clk?jk=6e286d9264efafab&fccid=649ddb83f098d4e5&vjs=3
Machine Learning Engineer (Hardware Acceleration) - Core ML,"Summary
Posted: Nov 7, 2018
Weekly Hours: 40
Role Number: 200006942
The Core ML team in the AI / ML group at Apple is looking for an exceptional software engineer to create high performance state-of-the-art machine learning software libraries. In this highly collaborative role, you will be at the center of multiple efforts to accelerate on-device machine learning. You will have an opportunity to collaborate with hardware teams in influencing future direction of hardware accelerators.
We are looking for someone with proven mastery of software development with familiarity with machine learning. You should have a strong mix of education and practical experience with a real passion for diving in to challenging problems head first.
Key Qualifications
Strong and proven software development skills
Good understanding of machine learning fundamentals
Proficiency in C/C++
Experience with Swift, Objective-C and Apple development tools is a definite plus!
Experience with Low level software and computer architecture.
Passion for software architecture, APIs and high performance extensible software.
Creative, collaborative, and product-focused
Excellent communication skills
Description
Work includes: Building and maintaining high performance machine learning frameworks that ship on all device classes. Ensuring high quality and agility with unit, integration and performance tests. You should possess strong skills in software design and programming and be passionate about developing new features, maintaining existing code, fixing bugs, and contributing to Apple's ML development tools strategy. Some familiarity with Low level software and computer architecture is expected.
Education & Experience
BS, MS or PhD in Computer Science with 4+ years experience
Additional Requirements
https://developer.apple.com/documentation/coreml
https://www.apple.com/iphone-xs/a12-bionic/",https://www.indeed.com/rc/clk?jk=9095ca16fe287284&fccid=c1099851e9794854&vjs=3
MACHINE LEARNING ENGINEER,"At AirPR, we are passionate about building software that solves important problems in marketing. We partner with the most valuable companies in the world to transform how they use data and technology to drive marketing and brand decisions. Our software has been used to strategize responses to a brand crisis, discover new content and influencers, and gain an edge in the global online business world.

As a Machine Learning Engineer, you will work on backend algorithms, robust and scalable data ingestion pipelines, machine learning services, and data platforms to support analysis on vast amounts of text and analytics data. You will apply your technical knowledge and Big Data analytics on AirPR’s billions of online content data points to solve challenging marketing problems. Machine Learning Engineers are integral to the success of AirPR.

RESPONSIBILITIES

Design and build scalable machine learning services and data platforms.
Create benchmarks and improve models for anomaly detection, seasonality calculations, and event attribution on time series data from multiple sources.
The system currently processes data on the order of hundreds of thousands of requests per second and terabytes per day.
Research, design, implement and validate cutting-edge algorithms to analyze diverse sources of data to achieve targeted outcomes.
Implement ML, AI and NLP techniques for article analysis and attribution.
Work with technologies like R, Ruby, Scala, Redis, ElasticSearch, Apache Spark, etc.
QUALIFICATIONS

BS, MS, or Ph.D in Computer Science or related field and/or equivalent experience in the space.
BS, MS, or Ph.D in Statistics or Mathematics or related field and/or equivalent experience in the space.
Software engineering experience.
Familiarity with frameworks such as MLlib, scikit-learn, H2O, Torch, TensorFlow, Theano, Caffe.
Experience with statistical analysis and/or correlation techniques.
Interest in applying machine learning techniques.",https://www.indeed.com/rc/clk?jk=460159a790d57fb3&fccid=3ef6655314901dcd&vjs=3
