Position,Description,Url
Siri - Machine Learning Manager,"Summary
Posted: Jan 23, 2019
Weekly Hours: 40
Role Number: 200007932
The Siri Core Engineering team is looking for an exceptional machine learning (ML) manager who is passionate about delivering innovative experiences and technologies to millions of users on existing and upcoming Apple products. This is a rare and unique opportunity to establish a new “Siri Core Intelligence” team, work on end-to-end features that span engineering, ML and UI, and even influence the design of the intelligence architecture of the world’s most popular virtual assistant. Candidates should not only be able to recruit and train ML engineers, but must have excellent programming skills with extensive experience integrating ML models into client devices under all types of system/computational constraints and managing the lifecycle of these models, including post-production data collection and model-debugging. Furthermore, to be successful in this role, candidates must have excellent interpersonal skills and a proven track record of collaboration and technical leadership.
Key Qualifications
5+ years experience applying machine learning to shipped products or services.
5+ years working on or with systems level components and frameworks.
2+ years experience updating deployed machine learned components.
2+ years managing machine learning engineers preferred.
2+ years as a machine learning engineer preferred.
Strong background in at least one area of machine learning, such as deep learning, ASR, NLP, robotics, computer vision, gesture recognition, multimodal fusion, etc.
Excellent algorithm and data structure skills (time and space complexity analysis, optimization, etc).
Proficiency in C/C++/Objective-C and Python.
Excellent software engineering design skills and practices.
Enthusiasm for continuing to learn state-of-the-art techniques in machine learning.
Proven track record of collaboration with excellent interpersonal skills.
Description
If hired, you will be spearheading a new “Siri Core Intelligence” team that will be responsible for intricately interweaving machine learning components at both the systems- and UI-level for end-to-end features. You will be influencing the design of the intelligence architecture of Siri in order to support next generation experiences for both existing and upcoming Apple products. To succeed in this role, you must have a strong background in both ML and engineering. As an engineer, you must know how to debug and ship code, manage legacy code, and re-architect as needed. As a machine learning specialist, you must appreciate the entire lifecycle of building, deploying and updating ML components in light of ever changing data. As a leader, you must be a proactive and determined problem solver who thrives in a fast-paced environment. Since Siri is a component of many different products, you must be able to work across organizations to synthesize requirements and top issues from each product into a coherent schedule, and set priorities for the team. Finally, you must be passionate about delivering compelling experiences for users while respecting privacy and paying close attention to details in the Apple way.
This position offers the right person a chance to play an important role in the next revolution in machine learning and human-computer interaction. You will contribute to a product that is redefining computing. You will be bringing intelligence to Apple products and to the millions of customers that use them. You will be the new lead of the Siri Core Intelligence team.
Education & Experience
M.S. or Ph.D. in Computer Science, Electrical Engineering, Statistics, Physics or related fields.",https://www.indeed.com/rc/clk?jk=bca206175036331f&fccid=c1099851e9794854&vjs=3
Senior Data Scientist,"CLARA is Latin for “Bright and Clear”. At CLARA analytics, we strive to add clarity to everything we do. We exist to reduce claims operational costs in Commercial Insurance by providing easy-to-use AI products. CLARA also comes from “Santa Clara”, our home and the heart of Silicon Valley.

We are looking for a Senior Data Scientist to participate in InsurTech innovations. We expect the senior data scientist is problem-driven. The role involves working on all stages of the data science pipeline, with emphasis on leading project, making adjustments by business needs, mentoring when needed, and coordinating between departments.

This is a chance to get in early with a rapidly growing Silicon Valley company, and to participate in developing the next generation of truly game-changing products in the Insurance Industry. Job title and compensation will be adjusted as appropriate to meet the experience level of the right candidate.

Key Responsibilities


Analyze various data sets and build sophisticated machine learning models
Design and optimize algorithms to achieve the best solutions
Collaborate with product management and engineering departments to understand company needs and devise possible solutions
Keep up-to-date with latest technology trends
Communicate results and ideas to key decision makers
Implement new statistical or other mathematical methodologies as needed for specific models or analysis
Participate in product ideation sessions, roadmap reviews and customer calls as needed

Qualifications & Experience


Strong quantitative and analytical skills with an advanced degree in a STEM discipline (MS/PhD)
Two-to-five years of U.S. work experience as a data scientist, machine learning engineer or research scientist
Ability to make appropriate judgement on priorities
Highly self-motivated for achieving the optimized solution with given data
Experience leading projects and mentoring is not required but preferred
Solid understanding of statistical modeling / predictive analysis/ machine learning / recommender system concepts
Experience using at least two of the following: Python, R, Scala, C, C++, SQL, Java. (Experience with Spark a plus.)
Ability to communicate complex quantitative analysis results in a clear, precise, and actionable manner using a variety of presentation tools including Excel, PowerPoint, etc.
Ability to work collaboratively and independently

Personal Characteristics


A passion for problem solving in general
A passion for InsurTech solutions using data available to date
Self-driven individual who can take a high-level idea and see it through to completion with minimal supervision and has the desire and ability to work in a fast paced, start-up atmosphere
Takes a pragmatic approach to problem-solving, combined with the ability to thrive under the pressure of constant change and moving objectives
Ability to work under tight deadlines and display grace under pressure
Excellent organizational, interpersonal, and communication skills (both written and verbal)

Additional information

At CLARA, we value diversity and always treat all employees and job applicants based on merit, qualifications, competence, and talent. We do not discriminate on the basis of race, religion, color, national origin, gender, sexual orientation, age, marital status, veteran status, or disability status.",https://www.indeed.com/rc/clk?jk=c35bacc1114fd512&fccid=3a00a0087ce2c05f&vjs=3
Senior Machine Learning Engineer,"Want to unlock insights from data to help doctors and nurses?
Apply to be on our data science team!

Have you ever found yourself or a loved one waiting hours and hours in a hospital Emergency Room to get care? Did you ever feel there weren't enough nurses to take care of all the patients in your area of the hospital? Or have you ever had a surgery scheduled for months in the future that needed to happen sooner? Unfortunately our healthcare system is full of these types of operational problems. Qventus is looking for a superstar machine learning engineer who can help redefine how healthcare systems work. Our work saves lives and helps hospitals cut tens of millions of dollars in operational costs, while improving the quality of care they're able to deliver.

Responsibilities
Develop robust, scalable production data products
Transform and convert data streams into structures needed for algorithm input. Verify data quality, and/or ensure it via data cleaning.
Integrate services that host the trained models into business processes.
Apply your experience in making intelligent, forward-thinking, technical decisions in our development process, including implementing new standards, tools, APIs, and workflows.
Work with our model designers and product teams collaboratively.
Participate in code reviews to ensure code quality and share best practices and experiences with the team.


Requirements
Strong and proven software development skills.
Have a mastery of data structures and database fundamentals, with solid Python expertise and experience with cloud services platforms (e.g. AWS Sagemaker, Snowflake).
Knowledge of various machine learning methods and libraries, natural language processing is a plus.
Several years of experience building production services. A track record of implementing data-driven products is ideal.
Experience building and productionizing microservices and APIs, experience with continuous integration and delivery.
Communication & Interpersonal Skills: empathy, transparency, and respect are core values of ours, and we maintain a great culture this way.
5+ years of professional experience.
Master's degree in computer science or a related field.


Apply if you are interested in helping us fix healthcare!",https://www.indeed.com/rc/clk?jk=2986210b5f3c2174&fccid=d4c2716420562e88&vjs=3
"Software Engineer, Machine Learning","Headquartered in the heart of Silicon Valley, Moveworks, an Enterprise SaaS company is solving complex problems using the latest ML & NLP technologies. Backed by industry leaders, Bain Capital & Lightspeed Ventures, and founded by well recognized serial entrepreneurs, Moveworks is transforming the ITSM market with autonomous resolution. Our product is well defined, our customers are already asking for more, and new demand is astounding.

As a Machine Learning engineer you will have an opportunity to work on challenging real applications that resolve a critical need for Enterprise customers. If you are skilled at large scale machine learning infrastructure, modeling, Natural Language processing and/or Information Retrieval within complex systems, this could be a very exciting opportunity for you.


Responsibilities:
Apply machine learning, NLP, and deep learning methods to unstructured data sets and complex systems.
Use your knowledge of machine learning fundamentals to develop and execute new algorithms, evaluate with small scale experiments and later productionize solutions at scale.
Investigate and solve exciting and difficult challenges in machine learning, classification, data science, content analysis, and deep learning.
Research and develop innovative, scalable and dynamic solutions to hard problems.
Use the latest advances in machine learning, data science, neural networks and deep learning to enhance our products and create new experiences.
Work on search/information retrieval problems.
Write quality code using cutting edge tools to develop chat capabilities.
Requirements:
You excel at building data pipelines to acquire/crawl, clean and maintain data for model building, as well as productionizing ML models
You have used ML toolkits like Scikit Learn, Apache Spark MLlib, H2O, Aerosolve or Apache Mahout
You feel at home developing on the Linux platform with languages like Python, Java/Scala, or C++
You have some prior experience working with Open source software or having contributed to it (Please share your Github profile)
As a bonus, if you have some familiarity with deep learning algorithms and frameworks like TensorFlow, PyTorch, Keras, or Theano
As a bonus, if you have some experience with NLP frameworks like SpaCY, Gensim or NLTK",https://www.indeed.com/rc/clk?jk=38d627b8eac48e7f&fccid=5b4ea6c0422a3b24&vjs=3
Machine Learning Engineer (Applied),"Machine Learning Engineers in our applied division design and build massively scaled systems that power the core of Diffbot's autonomous knowledge extraction system. You'll work with some of the world's most premier researchers in their field, both at Diffbot and in academic AI labs, to implement state-of-the-art models in our production datacenter.

Responsibilities


Improve accuracy of our production machine learning systems by applying the latest published research, feature engineering, and tuning of model hyperparameters
Own end-to-end accuracy and performance for our 60+ machine learning problems
Be up to date on the latest research publications, and rapidly assess the latest results for production and scalability potential
Work closely with product leadership and customers on training datasets and error analysis

Requirements


Masters in Computer Science or equivalent work experience
5+ years of industry experience designing and developing software
Experience implementing the latest machine learning algorithms from papers
Experience in designing performant production systems

Preferred Skills


2+ years Java, Python, C++, CUDA
Published research in CV/NLP topics
PhD in Computer Science

Perks & Benefits


Competitive compensation
100% company sponsored medical, dental and vision insurance
Free lunches, snacks and beverages
Customized computer setup
Unlimited paid time off
Parental leave
Dog friendly office
Commuter benefits
Ongoing learning through mentorship and education budget
Office setting - right next to downtown Mountain View and CalTrain, equipped with showers for bike commuters, great outdoor patio and work space
Work remotely when needed and work on a flexible schedule
Opt-in team events and get togethers - BBQs, game nights, poker nights, happy hours, hiking and more
Work with an exceptional team of bright, innovative, fun and ambitious individuals from all around the world

To apply, please submit:

A short self-introduction expressing your interest and above qualifications
A resume

",https://www.indeed.com/rc/clk?jk=2952348fe7582638&fccid=3b55a22daf80e7ff&vjs=3
Staff Machine Learning Engineer,"""The front page of the internet,"" Reddit brings over 330 million people together each month through their common interests, inviting them to share, vote, comment, and create across thousands of communities. Come for the cats, stay for the empathy.

Generating billions of events and terabytes of data a day, we're in the unique position to revolutionize content discovery on the internet. We are overhauling Reddit's search and relevancy infrastructure as we unleash the value of an exponentially growing petabyte-scale dataset.

You'd leverage state of the art technology to lead this effort from the ground level, delivering highly personalized experiences across our extremely diverse user-base.

If applying ML / AI in production to improve Reddit's content hotness rankings and search relevance while impacting our bottom line through ad targeting/utilization excites you, then you've found the right place.

Responsibilities:

Architect and implement the machine learning and relevancy platform at Reddit.
Apply Machine Learning / Artificial Intelligence to retrieve relevant results with optimal ranking.
Dig into how Reddit's customer behavior is unique and go beyond generic relevance algorithms.
Participate in the full development cycle: design, develop, qa, experiment, analyze, and deploy.
Collaborate across disciplines to find technical solutions to complex challenges.

Qualifications:

7+ years of experience as a Data Engineer or Software Engineer developing production code.
Familiar with large-scale data pipelines or ML / AI techniques.
Entrepreneurial and self-directed, innovative, biased towards action in fast-paced environments.
Able to communicate and discuss complex topics with technical and non-technical audiences.
Able to tackle ambiguous and undefined problems.

",https://www.indeed.com/rc/clk?jk=09c63d1adfcea04d&fccid=e7c7bace894a9291&vjs=3
"Machine Learning Engineer, Cash","Job Description

We are looking for machine learning engineers to join Square and help build Cash App, the fastest growing financial app in the world. Our mission is to make banking and financial services accessible to the underserved and unbanked. We move quickly, make incremental changes, and deploy to production every day.
As a machine learning engineer at Square, you will work alongside product engineering teams and data scientists to unlock the potential in our large and unique data by building machine learning systems that are used to detect fraud, automatically infer responses to inbound customer inquiries, understand key customer behaviors, surface product recommendations, and much more. You will also contribute directly to training machine learning models using techniques such as gradient boosted trees and deep learning.
You will:
Design and build systems to ingest and transform data for machine learning applications for our rapidly growing customer base
Collaborate with data scientists to train machine learning models using state-of-the-at techniques
Collaborate with subject matter experts and decision makers on how to design for and apply machine learning techniques in practice
Evangelize machine learning within product engineering teams
Help build the next generation of data products in Cash App

Qualifications

You have:
3-5 years of relevant industry experience
A graduate degree in software engineering, computer science, machine learning, artificial intelligence, applied mathematics, statistics, or a similar technical field.
Experience applying statistics and machine learning to creatively solve complex business problems
An appreciation for the connection between the software you build and the experience it delivers to customers
Technical initiative and a desire to perform and grow as an engineer and scientist
Technologies we use and teach
Java 9 including JUnit, Hibernate, Guice, and Jersey
Python (numpy, pandas, sklearn, xgboost, TensorFlow, etc.)
MySQL, GCP, AWS
Additional Information

At Square, we value diversity and always treat all employees and job applicants based on merit, qualifications, competence, and talent. We do not discriminate on the basis of race, religion, color, national origin, gender, sexual orientation, age, marital status, veteran status, or disability status. We will consider for employment qualified applicants with criminal histories in a manner consistent with the requirements of the San Francisco Fair Chance Ordinance.",https://www.indeed.com/rc/clk?jk=c1757f99713f7208&fccid=09abad886b83c501&vjs=3
Machine Learning Engineer,"Why you should join:

Join us in building the best ecommerce SaaS platform to revolutionize how retailers and brand engage with shoppers for post-purchase activities and more. Linc is looking for a machine learning developer who is passionate about applying ML techniques from natural language understanding, dialog system, recommendation system, knowledge extraction to deep learning. We offer a fun, dynamic and result-driven environment. If scale and complexity in a high growth startup excite you, Linc is the right place to be.


About Linc:

Linc is an AI-powered Customer Care Automation Platform that transforms one time purchasers into lifetime customers through a better than Amazon experience around tracking, returns, exchanges, and reordering. We also allow retailers to re-target and offer cross sells and upsells based on purchase history rather than browser history. We make this available to e-retailer or brand client via a number of channels including; web, email, text, and the emerging channels of Facebook Messenger and Voice. The end result is higher shopper retention rates and a higher lifetime value with those clients.

As a fast growing startup, Linc has delighted tens millions of shoppers, and customer list includes world-class brands like Carter’s, P&G, Crocs, GoPro, Hugo Boss, eBags, and L’Oreal. Learn more at letslinc.com.


Responsibility:


Works on one or more technical areas of applications of Natural Language Understanding, Dialog system, Statistical NLP, Contextual Understanding, Probabilistic Inferencing/Reasoning, Product Recommendation


Develops and demonstrates viability of novel solution in the context of Linc’s platform and data to deliver business results as well as best of breed user experience.
Be a part of an engineering team with total responsibility of both algorithms, systems and production scaling and support – full soup to nuts ownership and empowerment!
Key Qualifications:


3-7 years with at least 2 years in Machine Learning, Statistics and NLP related fields
MS or PhD program in Computer Science, Mathematics or a related field with demonstrated academic excellence
3+ years of programming experience, proficiency in Python and at least one of the objective oriented languages such as Java/C++/Go/Scala
2+ years of hands-on cloud platform experience: AWS or Azure
Strong knowledge in general software design, data structures, and relational database
Strong written and oral communication skills
Strong analytical skills, data driven mindset


Desired:

Previous experience working in a start-up environment
Experience with Ecommerce space, knowledge of product taxonomy building
Experience with NLP toolkits such as NLTK, OpenNLP, Stanford CoreNLP etc.
Experience with open source machine learning toolkits: TensorFlow, CNTK, scikit-learn, pandas, numpy, libsvm, Keras
Perks

We will sponsor Visas
Full medical and dental coverage
Company provided lunches and close to downtown Sunnyvale
Knowledge sharing sessions with some of Silicon Valley’s best minds
Please email jobs@letslinc.com if you are interested.",https://www.indeed.com/rc/clk?jk=7446cfe26a66068e&fccid=f5a628fb4dc10bb0&vjs=3
Applied Machine Learning Engineer,"Responsibilities
As a member of the Adobe Stock team, you will work on building and optimizing state of the art machine learning solutions, leveraging data mining, deep learning, content understanding, language understanding, and more. You will prototype and integrate new Machine Learning based approaches to deliver more personalized and delightful experiences to our customers.
You will independently design solutions as well as partner in a team environment across organizations. You will i dentify new ideas to analyze and evolve existing solutions and ML algorithms, develop new features, retrain and customize models, and benchmark possible solutions using platforms such as Adobe Sensei.
The ideal candidate will have a blend of science and engineering skills with a proven track record of solving critical engineering problems through strong analytical/quantitative and engineering skills.
What you need to succeed
BS/MS in Computer Science
Fundamental understanding of machine learning concepts including developing models and tuning the hyper-parameters, as well as deploying models and building ML services
Understanding of state-of-the-art Machine Learning techniques, Deep Learning, Recommendations and Computer Vision
Experience with data processing and visualization
Proficient knowledge in Python
Experience with frameworks like Sklearn, TensorFlow, Keras, Caffe or PyTorch
Experience developing full stack web sites and services using Node, PHP, JavaScript, HTML, and CSS
Have strong communication skills, analytical and problem-solving skills, the ability to work independently, and a strong focus on quality.
At Adobe, you will be immersed in an exceptional work environment that is recognized throughout the world on Best Companies lists . You will also be surrounded by colleagues who are committed to helping each other grow through our unique Check-In approach where ongoing feedback flows freely.
If you’re looking to make an impact, Adobe's the place for you. Discover what our employees are saying about their career experiences on the Adobe Life blog and explore the meaningful benefits we offer.
Adobe is an equal opportunity employer. We welcome and encourage diversity in the workplace regardless of race, gender, religion, age , sexual orientation, gender identity, disability or veteran status.",https://www.indeed.com/rc/clk?jk=55096b546c5d08c3&fccid=f89deb5a97c7738a&vjs=3
