Position,Description,Url
"Scientist/Machine Learning Engineer, Applied Science","About Amobee:
Amobee is a technology company that transforms the way brands and agencies make marketing decisions. The Amobee Marketing Platform enables marketers to plan and activate cross channel, programmatic media campaigns using real-time market research, proprietary audience data, advanced analytics, and more than 150 integrated partners, including Facebook, Instagram, Pinterest, Snapchat and Twitter. Amobee is a wholly owned subsidiary of Singtel, one of the largest communications technology companies in the world which reaches over 640 million mobile subscribers. The company operates across North America, Europe, Middle East, Asia and Australia. For more information, visit amobee.com or follow @amobee

Position Summary:
We’re changing the way the world thinks about online advertising and we are looking for talented scientists/engineers to join the Platform team and help us take it to the next level. Amobee’s Platform team develops all distributed and big data systems and applications to efficiently run Amobee’s online advertisement, data management, and analytics platforms.

The R&D team at Amobee is building the next generation of digital advertising technologies that power billions of ad impressions every month. We are constantly innovating – creating and applying technologies in several exciting cutting-edge areas: machine learning, constrained optimization, control systems, auction theory, game theory, collaborative filtering, experimental design, and information retrieval to name a few. Our mission is to use real-time data and scientific approaches to make quantum leap improvements in the performance of online ads, enhance user experience, enable efficient marketplaces, and improve the overall economics of online advertising.

The Applied Science team is growing. The job description is generic, however we have plenty of challenges to attract and hire at multiple levels, depending on experience and qualifications.

The Scientist/Senior Scientist/Lead Scientist - (Machine Learning Engineers) will work with the rest of the team to research, invent, and implement the next generation prediction, optimization, and analytics technology. You are a brilliant, motivated self-starter and an extremely fast learner with top notch problem solving, and analytical skills. You have a deep sense of curiosity and innate desire to dig deep into terabytes of data and love to play with the innards of complex algorithms, mathematical constructs and code.

Responsibilities


Research, design and/or implement solutions to challenging problems in real-time bidding domain, such as all kinds of optimization problems, audience understanding, etc.
Research and improve features and machine learning models for production pipeline.
Provide insights and suggestions on customer campaign optimization problems and product/platform optimization problems through statistical data analysis when needed.
Drive innovation by identifying and formulating new problems, publishing papers, filing patents, etc.

Required Qualifications:

PhD degree in a closely related field (e.g.: computer science/engineering, optimization) with publications in the area is strongly preferred
Or Masters with significant experience in advertising and Machine Learning
Experience in one or more of the following areas: machine learning, data mining, statistical modeling, optimization, algorithms, big-data, game theory
Proficiency with one or more programming languages - ability to write/debug production code.
Excellent communication skills – ability to present and communicate complex ideas in simple terms
Strong statistical/math/analytical abilities; Exceptional problem solving skills

Desired Qualifications:

Previous experience in the advertising industry
Strong programming experience with Java, C/C++, Python and/or Scala
Excellent knowledge in algorithms and data structures

Location: Redwood City, CA, USA

In addition to our great environment, we offer a competitive base salary, bonus program, stock options, well-stocked kitchen, employee development programs (e.g. reimbursement for online courses) and other comprehensive benefits. We provide immigration assistance. Please send a cover letter along with your resume when applying to the position of interest located at Amobee.com. We are an Equal Opportunity Employer. No phone calls and no recruiting agencies, please.

#LI-FO1 #GD",https://www.indeed.com/rc/clk?jk=5a26f9f40c80fe55&fccid=ebaa8a50df7c2d2f&vjs=3
Machine Learning Engineer II -Bots & Automation,"Liveperson is an expert based culture, built on the drive and passion of smart people! Our business is growing and we are looking for people like you!

LivePerson is the global leader in conversational commerce solutions and we aim to make life easier by transforming how people communicate with brands. Our 18,000 customers, including leading brands like Citibank, HSBC, Orange, Virgin Atlantic, RBS and Liberty Global, use our conversational commerce solutions to orchestrate humans and AI, at scale, and create a convenient, deeply personal relationship — a conversational relationship — with their millions of consumers.

Over the next three years, our goal is to transform the 268 billion analogue phone calls between a brand and it's consumers to digital on the LiveEngage platform. By doing this, we enable consumers to get back time and experience a more connected relationship with the brand in which sales, service, marketing, branches, stores, and contact centre's become a unified experience.

The successful candidate has an opportunity to join a highly outstanding team within a fast-paced and successful organisation. We are looking for a top notch Machine Learning Engineer who is passionate about applying NLP and Machine Learning to help brands better connect with their consumers. This engineer will play a crucial role in researching, designing and developing machine learning algorithms for large scale text data, across classification, data mining, and natural language processing.

In this role you will:

Design and implement new machine learning based approaches based on the

existing framework

Maintain as well as further enhancing existing machine learning modules for human

intent detection and also classification

Co-ordinate with Engineers to intregrate Machine Learning modules into the Bot Platform

and Messaging products.

Build prototypes where needed to evaluate the effectiveness of the Models.
Development of technical specifications and documentation

You should be an expert in:

3-5 years of experience
Master's Degree in Computer Science - Phd is a plus
Strong knowledge of different machine learning algorithms
Background in Machine Learning and NLP/NLU based applications
Strong programming skills in different OS (Linux, Windows, etc.): Python, Java
Take initiative to launch projects with the ability to quickly learn and develop own ideas in an interdisciplinary environment
Extracting high level logical structure from low level, multi-dimensional data
Having experience in Natural Language processing and Natural Language Understanding is a plus.
Good understanding of SOA Architecture and hands-on experience working with REST APIs
Deep Learning, Neural Network
Background or strong interest in NLP/NLU
Experience with NLTK, Gensim, and Python
Previous experience with either IR, NLP, text mining, machine learning or big data mining is highly desirable
Experience with one or more of the following: Natural Language Processing, text understanding, classification, pattern recognition, recommendation systems, targeting systems, ranking systems or similar

We care about you.

LivePerson works hard to create a positive employee experience. Your life outside of the office is important to us. We support our teams with great benefits, like pension plans, paid parental leave, and a competitive 28 days of paid time-off that enables our family to take the time they need to recharge.

We want you to feel part of our LivePerson family.

Frequent team events, daily breakfast and happy hours on occasion (and there are lots of those) will help you settle quickly into your new workplace.. And - our holiday parties are a blast! You can read more about LivePerson and Our Principles here -https://www.liveperson.com/company/#guiding-principals ( https://www.liveperson.com/company/#guiding-principals )

Our company believes equal opportunities for both genders is something that has been overlooked for too long.

To shake up the industry, LivePerson CEO Robert Locascio recently launched the Equal AI initiative - established to focus efforts on eradicating gender bias in AI engineering. We are also keen on getting women enthusiastic about software engineering by sponsoring ""WomenHack"" and ""Female's Favor{IT}e Conference"" events globally.

LivePerson provides equal employment opportunity without regard to an applicant's race, color, age, national origin, religion, sex, gender identity or expression, sexual orientation, veteran status, disability, pregnancy, genetic information, or any other status protected under applicable law.",https://www.indeed.com/rc/clk?jk=aac3ffca5c85bc01&fccid=0f50160682a8ab27&vjs=3
Machine Learning Engineer,"Atrium is the most data-driven platform providing legal services and applications to fast-growing companies. Atrium has helped hundreds of companies with everything from drafting and reviewing commercial contracts to raising over $500M in new capital. We’re based in San Francisco and have $75.5M in funding from top investors including Andreessen Horowitz, General Catalyst, Y Combinator, SV Angel, Greylock, and more. Atrium aims to disrupt Big Law and the $160 billion corporate legal services market.

Values of the Engineering A-Team:Product-minded: We work closely with our users (lawyers and clients) to understand their needs, so we can develop tools to make their jobs and lives easier.Ownership & Delivery: We work in small cross-functional teams, making a large impact on the products we create from idea to launch.Iterate quickly: We have a bias to build MVPs and collect direct feedback from the users of our software for faster iteration.
What would you be doing?
Build systems that improve efficiencies of lawyers and paralegals and write code that improves our data pipeline and experiences for customers
Implement and iterate on machine learning models
Implement the service/API that will serve results for using the machine learning model
Extract data from a database to prepare it for use with those models
Select the right tools for solving these kinds of problems, quickly experiment with approaches to find workable solutions, and implement those solutions as web services we can use.
What does success look like in this role?
Computer Science, Mathematics, or related degree
3-4+ years software engineering experience
2 years of applying machine learning and/or NLP techniques to solve real business problems
Experience building and deploying machine learning models to production
High proficiency in Python and ability to deploy API-based services to a cloud provider
Proficiency in querying databases using SQL
Independent, problem solving skills to work autonomously but also as a team player
Other key attributes: great listener, adaptable, continuous learner!

Experienced candidates seeking a ""Tech Lead"" role, let's talk! You should be able to demonstrate technical leadership and have a track record of deploying machine learning systems in an environment at scale.
What would you get from Atrium?
The rare opportunity to join one of the hottest SF startups with $65M in new funding. We're not just another legal tech company disrupting a traditional industry, we're transforming how legal services are provided!
Top-tier mentorship from experienced founders, including Justin Kan
Competitive compensation and sweet perks like catered lunch daily, Bevi machine, endless coffee, and snacks
San Francisco office across from 4th & King CalTrain with large private patio and views of downtown
Atrium is committed to building a diverse and inclusive company that celebrates and develops individuals of all backgrounds. We are an equal opportunity employer and encourage all applicants.",https://www.indeed.com/rc/clk?jk=f92675442be3683a&fccid=c12d31ad508866c3&vjs=3
Machine Learning Engineer,"About Scale
Scale is a rapidly growing post-Series B startup. Our mission is to accelerate the development of AI applications. Our first product is a suite of APIs that allow AI teams to generate high-quality ground truth data. Our customers include Alphabet (Google), Zoox, Lyft, Pinterest, Airbnb, nuTonomy, and many more, and we've become an industry standard for the self-driving car market.

We are building a large hybrid human-machine system in service of ML pipelines for dozens of industry-leading customers. We currently complete millions of tasks a month, and will grow to complete billions of tasks monthly.
As a machine learning engineer, you will:
Create optimized and efficient tooling, like Guided Automatic Segmentation, for taskers to complete complex tasks with speed and accuracy.
Reliably evaluate data quality at scale.
Intelligently route tasks from customers to specialized taskers for low turnaround and high accuracy.
Automatically hire, train and onboard taskers.
This role could be a fit if you have experience in one of the following:
Deep Learning: building CNNs.
Classical Machine Learning: non-deep learning methods (random forests, collaborative filtering, HMMs, etc.)
Applied ML Engineering: building large-scale data and machine-learning pipelines.
Requirements:
Experience with TensorFlow and/or Pytorch.
At least a Bachelor’s degree (or equivalent) in a relevant field.
Scale is an equal opportunity employer. We aim for every person at Scale to feel like they matter, belong, and can be their authentic selves so they can do their best work. We do not discriminate on the basis of race, religion, color, national origin, gender, sexual orientation, age, marital status, veteran status, or disability status.",https://www.indeed.com/rc/clk?jk=a4b3f4c4ab198524&fccid=55ebd28e88790c63&vjs=3
Machine Learning Engineer,"About Earnin:
Our financial system is fundamentally unfair for people who live paycheck to paycheck. People shouldn't have to wait weeks to get the pay they've already earned. This wait forces them to spend more than $100 billion a year on short-term credit products, late fees and overdraft fees.

Earnin helps people overcome this unfairness by giving them real-time access to their money as soon as they have worked -- without fees or interest.

Our team is bound together by a desire to level the financial playing field. We are a Series C funding from top-tier investors including DST Global, Andreessen Horowitz, Spark Capital, Matrix Partners, March Capital Partners, Coatue Management and Ribbit Capital.

You can help make a difference. Join us.

About the Team:
As a Fintech company where machine learning (ML) is one of the key features, our operations highly reply on machine learning models, from business decisions to customer experiences. Therefore, ensuring our machine learning systems' health and scalability is critical.

To guarantee the success of machine learning systems, work around transforming ML models to high performance production level code needs to be done, including not only implementing sophisticated machine learning algorithms but also robustness monitoring, system logging/alarming and devOps.

As a Machine Learning Engineer you will:

Focus on designing, building, and launching efficient and reliable machine learning (ML) services
Build and maintain predictor interface where the model predictions and decisions are provided
Enable automatic model refreshment
Build and own an automated deployment process, which enables continuous integration and deployment.
Improve logging, monitoring, alarming of the ML services
Track business performance of models with ad-hoc reporting and dashboarding
Build and own an automated rolling-out mechanism for ML models

Some skills we consider critical to being a Data Scientist:

At least 3 years of industry experience applying machine learning algorithms
At least 3 years of experience using advanced knowledge of Python, SQL
Familiarity with AWS suite
Familiarity with Kubernetes, Docker, shell scripts and Jenkins
Strong communication skills
BS or MS degree in Computer Science or a related technical field

",https://www.indeed.com/rc/clk?jk=7ff599355d1f7eb5&fccid=ac5b6e59f4a450b0&vjs=3
Staff Machine Learning Engineer,"Overview
In this role, you’ll be embedded inside a vibrant team of data scientists. You’ll be expected to help conceive, code, and deploy data science models at scale using the latest industry tools. Important skills include data wrangling, feature engineering, developing models, and testing metrics. You can expect to...
Responsibilities
Discover data sources, get access to them, import them, clean them up, and make them “machine learning ready”.
Work with data scientists to create and refine features from the underlying data and build pipelines to train and deploy models.
Partner with data scientists to understand, implement, refine and design machine learning and other algorithms.
Run regular A/B tests, gather data, perform statistical analysis, draw conclusions on the impact of your models.
Work cross functionally with product managers, data scientists and product engineers, and communicate results to peers and leaders.
Explore new technology shifts in order to determine how they might connect with the customer benefits we wish to deliver.
Qualifications
BS, MS, or PhD degree in Computer Science or related field, or equivalent practical experience.
Knowledgeable with Data Science tools and frameworks (i.e. Python, Scikit, NLTK, Numpy, Pandas, TensorFlow, Keras, R, Spark).
Basic knowledge of machine learning techniques (i.e. classification, regression, and clustering).
Understand machine learning principles (training, validation, etc.)
Knowledge of data query and data processing tools (i.e. SQL)
Computer science fundamentals: data structures, algorithms, performance complexity, and implications of computer architecture on software performance (e.g., I/O and memory tuning).
Software engineering fundamentals: version control systems (i.e. Git, Github) and workflows, and ability to write production-ready code.
Mathematics fundamentals: linear algebra, calculus, probability

Preferred Additional Qualifications:
Interest in reading academic papers and trying to implement state-of-the-art experimental systems
Experience using deep learning architectures
Experience deploying highly scalable software supporting millions or more users
Experience with GPU acceleration (i.e. CUDA and cuDNN)
Experience with integrating applications and platforms with cloud technologies (i.e. AWS and GCP)
Experience with NLP and NLU",https://www.indeed.com/rc/clk?jk=9746aa6d9b13e802&fccid=9784ae78e9834539&vjs=3
"Siri - Data Scientist, Advanced Development","Summary
Posted: Jan 30, 2019
Weekly Hours: 40
Role Number: 200031290
The Siri Advanced Development Group (ADG) is looking for an exceptional machine learning engineer who is passionate about incubating and deploying innovative technologies and features to millions of Apple users. As the research and development arm of Siri, ADG's charter is to prototype next generation experiences and capabilities by tightly coupling state-of-the-art core technologies, and even new hardware, to the user interface. We are an elite team looking for ambitious, strongly technical and creative thinkers, but also team players. Because of the nature of the work, you should be comfortable with uncertainty, taking calculated risks and failing fast.
Key Qualifications
3-5years experience with various machine learning/statistical modeling data analysis tools and techniques
Expertise in Python, Perl, or another scripting language
Proven ability to dive into data to discover hidden patterns and conduct error/deviation analysis
Track record of developing large-scale data modeling experiments, evaluating against strong baselines, and extracting key statistical insights and/or cause and effect relations
Strong background in design of experiment, A/B testing, and analytics
Experience working with end-to-end pipelines and/or crowd-sourced data labeling
Enthusiasm for continuing to learn state-of-the-art techniques in machine learning/data science
Excellent interpersonal and collaboration skills
Strong attention to detail and passion for data and numbers
Description
If hired, you will work with a passionate, product-focused team to ideate, rapidly prototype, and ship next-generation experiences for Apple products. You will work with large amounts of real-world data to analyze and develop user-facing features. You will ensure data quality throughout all stages of acquisition and processing, including designing data collection experiments, identifying ground truth, data wrangling, etc. Your expertise in defining and measuring the online and offline end-to-end metrics for our features will help communicate, evaluate, and iterate on state-of-the-art deployed models and predictors.
This position offers the right person a chance to play an important role in the next revolution in machine learning and human-computer interaction. You will contribute to a product that is redefining computing. You will be part of a team that’s creating groundbreaking conversational assistant technologies for both large scale systems and new client devices. You will work with the people who created the intelligent assistant that already helps millions of people get things done. You will be working in the Siri Advanced Development Group, at Apple.
Education & Experience
B.S., M.S. or Ph.D. in Computer Science, Electrical Engineering, Statistics, Physics or related fields.",https://www.indeed.com/rc/clk?jk=d6777c36c8bac24f&fccid=c1099851e9794854&vjs=3
"Machine Learning Engineer, WTE","Summary
Posted: Jan 9, 2019
Role Number: 200011731
Join our Wireless Technologies and Ecosystems (WTE) team and drive innovation that matters! We build and seamlessly integrate technologies that enrich people’s lives and deliver the absolute best user-experience.
If you are a talented code developer who wants to work on Machine Learning systems for the most advanced cellular devices in the world, then we may have the job for you. This role is for a full-time machine learning
engineer within WTE team, and key responsibilities will involve developing algorithms, model evaluation, error analysis and visualization for machine learning systems.
Key Qualifications
Strong working knowledge of machine learning algorithms such as classification, clustering, anomaly detection, neural network and model evaluation
Rich experience in building machine learning models & high-performance end-to-end systems
Agile development of data collection, model training, hyper parameter tuning and error analysis
Solid programming skills in Python and experience with Scikit-learn
Strong problem-solving and analytical skills
Excellent interpersonal written and verbal communication skills
Obsessively passionate and inquisitive, and seek to solve everyday problems in innovative ways
Laser-focused on the smallest details that are important to our customers
Description
The WTE platform SW team is looking for a talented ML Engineer to work on machine learning based classification system to greatly increase the bug analysis efficiency for cross function software teams.
The system utilizes both supervised and unsupervised techniques, and has intuitive web UI to visualize ML data pipeline and classification result. Key responsibilities include developing and integrating new ML algorithms, performing model evaluation and error analysis, and building a scalable platform that can be used across a large variety of technology domains
He / she needs to work closely with various software teams within Apple, onboard different technology domains to the unified platform, and present ML result regularly. He / she is also encouraged to come up with new ML ideas, develop prototypes and demo to management.
DAILY RESPONSIBILITIES:
You will lead 3rd Party Source Code, and deliver Source Code Management Solutions to the cellular technologies team.
You will develop state of art CI system for baseband software development, and ensure software build processes that meet Apple Standards.
You will develop Front End WebUI systems to deeply increase the bug analysis efficiency
You will develop custom solutions using Perl/Python for new analysis system/tools
You will work closely with complementary teams and provide support to all partners.
Education & Experience
Bachelor's degree in Computer Engineering or Computer Science Required.",https://www.indeed.com/rc/clk?jk=24a75c3fffda3ae1&fccid=c1099851e9794854&vjs=3
